,asin,overall,review
1398491,B001DKMZ3G,2,"I purchased the 24 pack of colored pencils. If you're not a serious coloring person, these are great. However, the majority of the pencils, after being used, when they needed to be sharpened, fell apart, repeatedly, in the sharpener.  I thought perhaps it was the sharpener, so I tried another, but the same thing happened.  I even had a friend try to sharpen a couple pencils for me, in case the problem was me.  Nope, these colored pencils don't seem to be up to adult coloring standards, at least for me.  Might be good for kids though. Sub-standard for Adult Coloring"
1398492,B001DKMZ3G,5,High quality. I took it for my son. High quality.
1398493,B001DKMZ3G,5,Purchased as a gift for my 8 year old niece. They include lots of colors so I'm sure she will love them to draw with. Lots of colors
1398495,B001DKMZ3G,5,i love my pencils Five Stars
1398496,B001DKMZ3G,5,These are top of the line round shaped pencils Great comfort pencils
1398497,B001DKMZ3G,5,Lovely colors Five Stars
1398498,B001DKMZ3G,5,Great colors and lots of them! Five Stars
1398499,B001DKMZ3G,4,Good color Four Stars
1398502,B001DKMZ3G,5,"The lead is just right, not too soft, not too hard, roll the pencil in your fingers as you use them, this keeps the lead sharp, don't let it get flat on one
side, that is how you wear them out.  They are the best I've found.  V. Wright They are the best I've found"
1398503,B001DKMZ3G,5,"I really like some of the colors this set has, they're different (in a good way) from other sets. Good stroke and color application, none broken yet. Great colors"
1398505,B001DKMZ3G,5,Great set of Color pencils for the price! My wife bought these in hopes of finding a decent set to color with that my daughter could also use. These pencils do an amazing job an are just as good as the other high end brands out there. Amazing deal for some amazing pencils! Great set of Color pencils for the price
1398506,B001DKMZ3G,5,great Five Stars
1398507,B001DKMZ3G,4,"I was upset that my box came ripped. I contacted Amazon and they instantly refunded me which was great because this was meant to be a gift. So I tried the color pencils and I did like them, they're smooth and pretty. Some colors seem to be the same but when you press hard you can tell a slight deference. Color pencils, bad packaging."
1398508,B001DKMZ3G,5,Very soft leads are great for smooth coloring and sharpen nicely for fine lines in adult coloring book. So ar these are the best colored pencils I have found other than the very expensive art pencils purchased singly from the art store. Very soft leads are great for smooth coloring and sharpen nicely for fine lines ...
1398509,B001DKMZ3G,5,My son loves these pencils.  Variety of color.  Item shipped in a timely manner and the item is exactly what we expected. My son loves these pencils. Variety of color. ...
1398510,B001DKMZ3G,4,good for adult coloring Four Stars
1398511,B001DKMZ3G,4,beautiful one beautiful colors
1398512,B001DKMZ3G,4,"Pencils, not much to say! Four Stars"
1398513,B001DKMZ3G,5,"Great selection of colors. The first time I ordered I only received 33 pencils, but a quick email to Amazon and they sent me a full replacement. Works well with my adult coloring books! Great selection of colors"
1398514,B001DKMZ3G,5,PERFECT! Five Stars
1398515,B001DKMZ3G,5,"I got this for my girlfriend! She loves them, a great variety of colors, and pretty decent quality! HIGHLY RECOMMEND!"
1398516,B001DKMZ3G,4,Good selection of colors. Four Stars
1398517,B001DKMZ3G,5,The pencils are really good quality and you can't beat the price for that quantity. I bought them as a gift but plan on buying them again for myself. Great Quality. Great Price.
1398519,B001DKMZ3G,5,"Good quality, lots of colors. Five Stars"
1398520,B001DKMZ3G,2,"The only reason I even gave 2 stars I because they were all there. They lost the other 3 because only about half of them were still in the original packaging upon arrival. The rest were laying all over the bigger Amazon box that my items came in. Not a good Christmas gift since my pencil box is torn open. Buyer beware, I would not recommend these to anyone."
1398521,B001DKMZ3G,5,bought for daughter in law Five Stars
1398522,B001DKMZ3G,1,looked like it had gotten wet and then dried. received late and now would like a refund instead of a replacement since they were supposed to be part of a Christmas present. looked like it had gotten wet and then dried
1398523,B001DKMZ3G,5,Great colors. Quick arrival! Five Stars
1398524,B001DKMZ3G,4,have a lot of fun with these they last a good amount of time and the colors are good.. Four Stars
1398525,B001DKMZ3G,5,Great Five Stars
1398526,B001DKMZ3G,5,These pencil will bring many hours of play. Perfect gift to use. So many beautiful colors.
1398527,B001DKMZ3G,5,"Good artist quality pencils. pigments lay down smoothly, not waxy. Great for adult coloring books. Good Artist quality pencils"
1398528,B001DKMZ3G,5,So many colors!! Great
1398529,B001DKMZ3G,5,Gifted to homeless kids Hoping they like these
1398530,B001DKMZ3G,5,Great pencil pack! Five Stars
1398531,B001DKMZ3G,1,I only received 22 pencils in the box so I had to return them and reorder. One Star
1398533,B001DKMZ3G,4,Great color selection not the greatest of color to paper. Four Stars
1398534,B001DKMZ3G,1,Only had 46 pencils in the pack. Look used. Do not recommend. not happy
1398535,B001DKMZ3G,4,"Good product, good color, but flimsy box, bends under the weight of the pencils.  Need another container. Four Stars"
1398536,B001DKMZ3G,5,Great quality Five Stars
1398537,B001DKMZ3G,5,"Good quality, and they last. Five Stars"
1398538,B001DKMZ3G,4,The kids are going to love these. Four Stars
1398539,B001DKMZ3G,4,FAST DELIVERY AND GOOD Quality Four Stars
1398541,B001DKMZ3G,4,They are just as described.  My grandkids love them!! Good buy.
1398542,B001DKMZ3G,5,Very nice kit at a great price. Nicely fit in a glass in the center of the table where my kids do their homework. Purchased more after the first box arrived. Great pack at a great price.
1398543,B001DKMZ3G,5,Adequate for the purposes required. Five Stars
1398544,B001DKMZ3G,4,Nice sturdy pencils. Four Stars
1398545,B001DKMZ3G,5,"These are colored pencils. Nothing extra special about them really. One good thing I can say about them is that I have a heavy hand when coloring, and tend to break the points off. This did not happen with these. They are good quality in that sense. Strong but basic"
1398546,B001DKMZ3G,4,"Great pencils but I can't seem to keep them sharpened well and I have several different types of sharpeners, battery, electric and hand. Nice"
1398547,B001DKMZ3G,5,I really like these and bought8 sets for gifts. I tried them myself and I really love the way they blend easily. Other pencils I got wouldn't blend. You can add colors to work already done and it looks great! Very happy and surprised!
1398548,B001DKMZ3G,5,Love them Five Stars
1398549,B001DKMZ3G,5,very good deal for the price. in my area this is $3 less then in the brick and mortar stores. Pencils have the name written on them which is helpful and the pencils don't break easy from use or sharpening. great set for coloring
1398550,B001DKMZ3G,5,great deal kids love them Five Stars
1398551,B001DKMZ3G,5,Gift Five Stars
1398552,B001DKMZ3G,5,I liked these pencils so much I bought another package to use. Five Stars
1398553,B001DKMZ3G,2,color not intense enough OK for kids Two Stars
1398554,B001DKMZ3G,5,Just what I need Thank you
1398555,B001DKMZ3G,5,This has a large variety of color shades compared to most. Five Stars
1398556,B001DKMZ3G,4,Box Came ripped Four Stars
1398557,B001DKMZ3G,5,Service and product is great. Five Stars
1398558,B001DKMZ3G,5,Nice product Five Stars
1398559,B001DKMZ3G,5,Christmas Gift Five Stars
1398560,B001DKMZ3G,5,These color pencils are great for pencil coloring! Easy to shade and blend . I have purchased several for friends who are recovering from surgery or illness to pass time and if course I sent them color books and a sharpener so they could get started right away! Beautiful pencils and the price is right!
1398561,B001DKMZ3G,5,My roommate loves to draw to relax. Colored pencils for art
1398562,B001DKMZ3G,4,"Nice pencils but for as many colors as there are, they're missing a good dark brown and a couple of other colors that would make it well-rounded. I also wish the metallic gold pencil was more metallic. Pretty good"
1398563,B001DKMZ3G,5,Very nice coloring pencils.  What an impressive gift these will make! Five Stars
1398565,B001DKMZ3G,4,good Four Stars
1398566,B001DKMZ3G,5,Nice Five Stars
1398567,B001DKMZ3G,5,"pencils color selection is very good. the 'lead"" is just the right texture for great coloring! Five Stars"
1398568,B001DKMZ3G,4,geart set Four Stars
1398569,B001DKMZ3G,5,Nice bright colors and fluid color. Even beautiful color every time. These are great and work really well in a variety of applications. Nice color
1398570,B001DKMZ3G,5,"great quality, lots of nice colors great selection"
1398571,B001DKMZ3G,2,These are ridiculously small...I normally wear an 18/20 and could not get these past my hips.  The material is nice so I gave them the 2 stars. Not plus size
1398572,B001DKMZ3G,4,item was a gift Four Stars
1398573,B001DKMZ3G,2,Very poor quality Two Stars
1398574,B001DKMZ3G,5,Great deal on these pencils!!! Five Stars
1398575,B001DKMZ3G,4,Not the greatest brand but a good budget brand! Great budget brand!
1398576,B001DKMZ3G,5,"Requested by grandson.  Daughter told a friend I probably bought him a set of 500; told her no, just a 1/10 of it.  I opened the box and loved the different colors I saw.  He will enjoy.  Prompt delivery. Nice set."
1398577,B001DKMZ3G,4,They did the job! Four Stars
1398578,B001DKMZ3G,5,"Arrived quickly, great price. great price."
1398579,B001DKMZ3G,5,Great for the price. Five Stars
1398581,B001DKMZ3G,5,Nice set even for a beginning Adult colorer. Five Stars
1398582,B001DKMZ3G,5,Excellent pencil st an outstanding price! Excellent
1398584,B001DKMZ3G,5,Love them! Five Stars
1398585,B001DKMZ3G,5,Granddaughter loves them. Five Stars
1398586,B001DKMZ3G,4,will be given in x-mas present Four Stars
1398587,B001DKMZ3G,5,"Fast shipping and as described, will go great with new coloring books. Can't wait to use! Great Christmas presents! Best price! High quality!"
1398589,B001DKMZ3G,5,These pencils are great. Good quality and bright colors. You don't have to press really hard to get good solid coverage. I will be ordering more of these. I just wish they came in bigger packs. Great Quality and Great Price
1398590,B001DKMZ3G,1,Box came destroyed. Bad packaging
1398591,B001DKMZ3G,2,"Very very dull, color barely shows. Disappointing Two Stars"
1398592,B001DKMZ3G,5,Great pack of colored pencils for my grandson to start drawing with. Great pack of colored pencils for my grandson to start drawing with.
1398593,B001DKMZ3G,5,Great colors and tips hold up well. Five Stars
1398594,B001DKMZ3G,5,This is a Christmas gift and has not been tried. Five Stars
1398595,B001DKMZ3G,5,great Five Stars
1398596,B001DKMZ3G,5,Awesome Set Has Great Colors!! Five Stars
1398597,B001DKMZ3G,5,"Item as described, good transaction. good transaction."
1398598,B001DKMZ3G,4,needs a sharpener Four Stars
1398599,B001DKMZ3G,5,My son got these for his birthday and they are quite nice! Nice!
1398600,B001DKMZ3G,5,this is a git Five Stars
1398602,B001DKMZ3G,2,Do not like round shaped pencils.  Tendency to break off tips after sharpening. Two Stars
1398603,B001DKMZ3G,5,Great!!! Five Stars
1398604,B001DKMZ3G,5,Very nice set Very good quality
1398605,B001DKMZ3G,4,"This set has gold and silver pencils!  I've been coloring with smaller count sets and/or old colored pencils left over from my kids' school days! Thes pencils seem to be good quality altho a couple had broken tips.  For the price, I'm happy to have a large range of colors. Nice set and it has a gold and a silver!"
1398606,B001DKMZ3G,5,Good pencils for a good price. Five Stars
1398607,B001DKMZ3G,4,"Very nice colors are included. I wish I would have gotten 50 different colors instead of 2 of every color. Needs a stronger package. The cardboard is very unsupportive. I got a storage container for me. When I received them ,the pencils were all ove the box. However, they work well and cover the page nicely. Please do not pass these pencils by just because of bad packaging. Very nice colors are included"
1398608,B001DKMZ3G,4,plenty of colors but not dark enough Four Stars
1398609,B001DKMZ3G,1,Terrible package....pencils all mixed up and fell out of package....would not buy again. One Star
1398610,B001DKMZ3G,4,Lots of colors Four Stars
1398611,B001DKMZ3G,5,Reliable quality pencils.  Great price. Great price.
1398612,B001DKMZ3G,5,Lucky to get these as a lightning deal.  Great product.  Outstanding price.  Perfect Advent/ Christmas gifts. Happy to have!
1398613,B001DKMZ3G,5,Great Five Stars
1398614,B001DKMZ3G,5,Beautiful pencils.  Very smooth. Five Stars
1398615,B001DKMZ3G,4,For 50 pencils not many color options. Colors all very similar. Ok
1398616,B001DKMZ3G,4,Seem pretty nice. Wishing some of the basic colors where more closely related. But only used once so far to help my son with a school project that required family participation. Debating it it's worth the price. Nice pencils
1398617,B001DKMZ3G,5,Thought this would be a great gift Never received
1398618,B001DKMZ3G,5,"These are very nice pencils. I haven't had a lot of opportunity to use them, but I can't wait to make time. I also bought these along with adult coloring books as gifts. These are very nice pencils. I haven't had a lot of opportunity ..."
1398619,B001DKMZ3G,5,came as described. great condition great
1398620,B001DKMZ3G,4,Seems to be as promised for a fair price. Every color you'd need !
1398621,B001DKMZ3G,4,they are nice Four Stars
1398622,B001DKMZ3G,5,THESE PENCILS ARE PERFECT! THEY WERE JUST DELIVERED AND I AM ALREADY TRYING THEM OUT! THE COLORS ARE AN EXCELLENT AND THE CHOICES ARE MANY. THE COLORS APPLY VERY WELL TO PAPER AND DONT SMEAR IN ANY WAY! PERFECT FOR DRAWING AND SKETCHING......THANK YOU! SARAH WURM ROSSI THESE PENCILS ARE PERFECT! THEY WERE JUST DELIVERED AND I AM ALREADY ...
1398623,B001DKMZ3G,5,Good quality for a good price Colored pencils
1398624,B001DKMZ3G,5,"These color fantastic, I love them! Amazing pencils."
1398625,B001DKMZ3G,2,Colours don't layer on top of one another like other pencils do. White doesn't show up at all because of this. Colours don't layer on top of one another like other pencils do
1398626,B001DKMZ3G,5,my kids love to colour.  We have the Crayola pencil crayons..  and we've seen some blackfriday sale for a 24 to 30 pack..  but this is far cheaper. my kids love to colour
1398627,B001DKMZ3G,5,great! Five Stars
1398628,B001DKMZ3G,5,Great quality with a lot of color. Very smooth on paper. Great quality
1398629,B001DKMZ3G,5,bought multiple ses for gifts Five Stars
1398630,B001DKMZ3G,5,I love these Sargent pencils. They are long and easy to hold. They color very smoothly. No dragging.  Easy to sharpen in the Prismacolor Scholar sharpener. Love these!
1398631,B001DKMZ3G,4,"look really special, haven't had a chance to use them yet Four Stars"
1398632,B001DKMZ3G,5,GREAT COLORS COLORING PENCILS
1398633,B001DKMZ3G,4,Wish the names of the colors were listed on the side of the pencil for memory... otherwise bust out your rubber bands to group colors for a page you are working on and can't finish Great buy.... no color names
1398634,B001DKMZ3G,4,Good accessory for the adult coloring books I got for my granddaughter. The whole family got involved. Good accessory for coloring books for those beyond 4th grade.
1398635,B001DKMZ3G,5,I love to draw. I go through pencils like there is no tomorrow. This inexpensive package of pencils had many colors and the leads are soft enough to draw deep rich colors. 50 colors for few dollars? sign me up!
1398636,B001DKMZ3G,5,So many different color to choose from.  My daughter just love them.  I love the price. My daughter just love them. I love the price
1398637,B001DKMZ3G,5,"Good quality; excellent selection of what would be called ""natural hues"". Five Stars"
1398639,B001DKMZ3G,4,"Very nice quality pencil, the colors are a little mismatched, for example the olive green is more of a bright lime green. My biggest beef is the duplicates; two blacks and two whites, perhaps more, but those are the two I've found this far. I'd rather have a couple more shades of, say the red color spectrum, than duplicates, but I'm still very happy with this purchase. Has duplicates"
1398640,B001DKMZ3G,5,"Purchased for a Christmas gift, but they appear to be top quality & I love the assortment of colors. but they appear to be top quality & I love the assortment of colors"
1398641,B001DKMZ3G,5,They're great. Five Stars
1398642,B001DKMZ3G,1,Pencil box was open and there were only 42 colored pencils out of the 50. Missing pencils
1398643,B001DKMZ3G,2,The colors are too faint for me. Rather use markers.
1398645,B001DKMZ3G,4,Nice colors but some do not match their name or color of the exterior shade.. Not all correct.
1398646,B001DKMZ3G,5,Great pencils - great value! Highly recommend this item! Great product!
1398647,B001DKMZ3G,4,Love these pencils.  Bought them for my adult coloring book. Four Stars
1398648,B001DKMZ3G,5,love them! beautiful colors! Five Stars
1398649,B001DKMZ3G,5,New colored pencils for the adult coloring book. Five Stars
1398650,B001DKMZ3G,5,SUPERB SET OF PENCILS THAT WILL LAST ME AQ LONG TIME!  FIRST RATE! Five Stars
1398651,B001DKMZ3G,5,great set of colored pencils! Five Stars
1398652,B001DKMZ3G,5,Christmas gift Five Stars
1398653,B001DKMZ3G,5,Gift Five Stars
1398655,B001DKMZ3G,5,sharp color
1398656,B001DKMZ3G,5,I like these pencils. But they aren't as bright in color as I would like while using. But they are great for starter pencils. I like these pencils
1398657,B001DKMZ3G,5,Love them Five Stars
1398658,B001DKMZ3G,1,Box was damaged and pencils disorganized. Completely unacceptable. Damaged Box
1398660,B001DKMZ3G,1,"I got the pencils with several other items. The box was open, they scattered all over the larger box and 7 of the pencils were missing. missing product"
1398661,B001DKMZ3G,5,Nice set with a great variety of colors for me to use with my adult coloring books great for someone into casual coloring
1398662,B001DKMZ3G,4,I love all the amazing colors it has!!! Four Stars
1398663,B001DKMZ3G,5,"Adults and children alike are happy with these. I color with them, the grandchildren like them, and they are helpful for people taking Anatomy and Physiology classes. They make shading so much fun.  I have not heard one complaint yet. Great colors"
1398664,B001DKMZ3G,5,CHRISTMAS GIFT COLOR YOUR BLUES AWAY
1398665,B001DKMZ3G,5,"Very nice, as expected. Five Stars"
1398666,B001DKMZ3G,5,Super ok Five Stars
1398667,B001DKMZ3G,5,Love them. Ordered a couple for gifts and one for myself.  Thanks you. Five Stars
1398668,B001DKMZ3G,5,High quality coloring pencils.  Recommended Five Stars
1398669,B001DKMZ3G,5,Decided to buy because my son stole all my Crayola brand colored pencils. I an not an artist so all I can tell you is that they do what I need them to do. Good amount for the price.
1398670,B001DKMZ3G,5,Good value! Five Stars
1398671,B001DKMZ3G,5,The items arrived on time and as promised Five Stars
1398673,B001DKMZ3G,5,nice pack Five Stars
1398674,B001DKMZ3G,5,Nice pencils. Five Stars
1398675,B001DKMZ3G,4,"they seem very nice, but very poor packaging, when i received them they were all scattered across the box with other items in it, and they wouldn't really fit right inside the box after i rearranged them all good prodcut, bad packaging"
1398676,B001DKMZ3G,5,Very nice and the way it glides across paper. My husband will love them. Smoothe and silky
1398677,B001DKMZ3G,1,"Because of the good reviews, I was hoping for a great set of coloring pencils but was disappointed. You do get 50 pencils however there are 2 blacks and 2 whites and 10 different shades of green and 9 different shades of blue. There is no true purple but there are 3 different shades of violet. There are 3 shades of red, 3 of orange, 4 of yellow, 3 of pink, 4 of brown, 4 skin tones, 1gray, 1 silver and 1 gold. If you are going to put 50 coloring pencils together, at least have a wider variety of colors and don't double up on a couple of the colors. I don't really care for how they color either. The colors are not all that vibrant. Here's hoping PrismaColor has a great sale at some point. ;) Needs a better variety of color"
1398678,B001DKMZ3G,4,"Colours are somehow uninspiring and not ""punchy"" enough, but quality product nonetheless. Four Stars"
1398679,B001DKMZ3G,4,"Great starter set for my first foray into the world of adult coloring books, and the value for the price was huge! Now that I'm hooked,  just may need to upgrade for more colors but very happy with this Great value"
1398680,B001DKMZ3G,4,great price Four Stars
1398681,B001DKMZ3G,5,"Great pencils, I bought them for my grandchildren with coloring books for Christmas.  They always use mine so, I decided to buy them their own. Great pencils and price with lots of colors."
1398682,B001DKMZ3G,2,The colors are way too similar. I'd upgrade to less colors in a better brand. You actually will get more differentiated colors. Colors too similar
1398683,B001DKMZ3G,5,My grandchildren love these Nice
1398684,B001DKMZ3G,2,Poor color payoff. Two Stars
1398685,B001DKMZ3G,5,Great colored pencils. They seem to last a long time even though you sharpen them a lot. Great colors and easy to use. Colors Galore
1398687,B001DKMZ3G,5,Nice pencils good amount. Colors are grest Great
1398690,B001DKMZ3G,5,"Great Colors at a great price.  They are a good quality Pencil, bright colors. Well Made"
1398691,B001DKMZ3G,5,love Five Stars
1398692,B001DKMZ3G,5,Lots of great colors. They will be perfect for an upcoming project. Nice
1398694,B001DKMZ3G,2,You get what you pay for. The quality of these pencils are sub par. Wishing I'd forked out a little extra cash for better quality. The pencils are extremely light no matter how hard you press or how many times you go over the same spot. Not great.
1398696,B001DKMZ3G,5,my mother in law loves them. she does adult coloring gift for mom
1398697,B001DKMZ3G,4,"These are great. I bought these to accompany my
coloring book and I like using them. Good Color Pencils"
1398698,B001DKMZ3G,5,Received quickly and good product Good product for good price
1398700,B001DKMZ3G,5,Great colors that blend nicely Five Stars
1398701,B001DKMZ3G,5,"Great product, great price! Five Stars"
1398702,B001DKMZ3G,4,"I really like this set, especially for the price. But the colors aren't exactly what you would expect. For example, ""peach"" looks more like a bright tan. For some reason, there are two ""white"" pencils, and there are tons of shades of brown and green. It would be nice to have a wider selection of reds and blues, for example. Also, the package came open during shipment and the pencils spilled out into the box, breaking a lot of the tips so they had to be sharpened immediately. So you won't be storing the pencils in the box it comes in. Overall, a good value for the price paid. A nice selection of colors"
1398703,B001DKMZ3G,5,"Great colors and quality! I bought these as a gift, and the recipient was super happy with them. Five Stars"
1398704,B001DKMZ3G,1,I think these were so inexpensive because they are rejects. I ordered 3 boxes and the names of the colors are the same but the colors are not even close to each other from box to box. The red looks brown in one box. The tips were broken on several of them Poor Colors
1398705,B001DKMZ3G,1,"Product arrived in pieces, fallen out of the mangled box.  This was supposed to be a Christmas gift.  Thoroughly disappointed. Thoroughly disappointed."
1398706,B001DKMZ3G,2,"I was really excited to see this product at such a great price, but upon arrival, I was disappointed to see the box opened and the pencils loose and rolling around with the other items I had ordered. Several were broken. I ordered these for my personal use, since my children had put my other set to use at school, and am disappointed to say that these are going straight to the crayon/marker/pencil box for the kids. ... really excited to see this product at such a great price, but upon arrival"
1398707,B001DKMZ3G,5,Great product especially considering the price value ratio. Five Stars
1398708,B001DKMZ3G,4,Great colored pencils. I love them. Great colored pencils
1398709,B001DKMZ3G,1,They work less than crayola brand One Star
1398711,B001DKMZ3G,5,They worked great! Five Stars
1398712,B001DKMZ3G,1,Not dark or vibrant colors needed for adult coloring. Colors not vibrant.
1398713,B001DKMZ3G,1,Only came with 30 pencils. Missing half the pencils
1398714,B001DKMZ3G,5,Ups delivered to a under construction part of the house (called it a rear door) instead of the main door of our home which has 3 steps and a ramp and chair to place boxes on plus a covered area. To protect in weather. The boxes were soaked. Not happy. I had to carry inside around lumber upstairs with heavy soaked boxes. I cannot complain to ups maybe Amazon can! I think it was a sub driver. Not happy. I had to carry inside around lumber upstairs ...
1398715,B001DKMZ3G,4,Vibrant colors! Great stocking stuffer
1398716,B001DKMZ3G,5,Received on time and as advertised. Christmas gift
1398717,B001DKMZ3G,5,"Write and color smooth, great choice of colors available I love them!"
1398718,B001DKMZ3G,5,"Nice amount , good colors... and don't forget the sharpener.... a must. Nice amount, good colors"
1398720,B001DKMZ3G,5,Ordered this case on a whim and I absolutely love it! Well worth the price for a slim case that feels very protective of my phone! Will definitely buy again!! Very nice!
1398721,B001DKMZ3G,1,Received with broken box and missing two pencils inside One Star
1398722,B001DKMZ3G,5,nice. Five Stars
