,asin,overall,review
1399287,B001DKMZ3G,5,Im glad i bought this product and very happy for the good price. Would definitely buy it again and again :) Buy again
1399288,B001DKMZ3G,4,they are very soft and hard to use Four Stars
1399289,B001DKMZ3G,5,"Loved the 50 colors, ordered for my adult daughter (24) with the adult coloring books.  Very therapeutic, adults can color!  She loved the choices of colors, I order another for myself since I received a adult color book from my mother. Love the 50 color choices!"
1399290,B001DKMZ3G,5,Any color you could want you have.  Easy to sharpen and use.  They are great for shading in the adult books. adults rejoice
1399291,B001DKMZ3G,5,These pencils were a pleasant surprise to me.  I love the way they color and shading is so easy with them.  Superb product! I love the way they color and shading is so easy ...
1399292,B001DKMZ3G,5,great selection of shades. enjoying Five Stars
1399293,B001DKMZ3G,5,Great set of good quality pencils for the price. Five Stars
1399294,B001DKMZ3G,5,"good, quality pencils with lots of different colors. great value Five Stars"
1399296,B001DKMZ3G,1,The worst colored pencils that I ever bought. A total rip off for the money. I will never buy any Sargent Art product again. These pencils are grainy on your art work. They break easily and smear at times. They are hard to sharpen and are not smooth on art work. Do not waste your hard earned money on these colored pencils like I did. BUYER BEWARE !!!!!These pencils are a JOKE. Worst colored pencils I ever bought. Buyer Beware !!!!
1399297,B001DKMZ3G,5,good buy! Five Stars
1399298,B001DKMZ3G,5,The pencils were given as a gift and the vast amount of colors are great. ... a gift and the vast amount of colors are great.
1399299,B001DKMZ3G,5,Great colors Five Stars
1399300,B001DKMZ3G,5,Very nice assortment of colored pencils Very nice assortment of colored pencils
1399301,B001DKMZ3G,5,Excellent. Thanks. Five Stars
1399302,B001DKMZ3G,5,The colored pencils worked well on wood.  The group enjoyed coloring in areas on their wood burning projects.  Different colors of pencils in this set are marvelous and we used different colors in our wood projects.  Colors didn't bleed when the wood pieces got wet and the spray sealed the colors in the wood.  We look forward creating our masterpiece in our spare time. Colored Pencils for Wood Burning Projects
1399303,B001DKMZ3G,5,So easy to use.  I guess I will stick to Sargent Five Stars
1399305,B001DKMZ3G,5,Supah dope Five Stars
1399306,B001DKMZ3G,5,"Good sturdy coloring pencils, I haven't had any problems yet, they even survived my younger sister who is sometimes rough on art supplies. Good and sturdy"
1399307,B001DKMZ3G,5,"Love these, soft enough to do blending and shading, hold up very well.  They compare great to some more expensive options such as prismacolor.  I own both and the prismacolors are great but for the minimal difference in performance I would buy these and save some money. Great product for the price!"
1399308,B001DKMZ3G,4,Good range of colors. Good quality pencils. Four Stars
1399309,B001DKMZ3G,5,great Five Stars
1399310,B001DKMZ3G,5,JUST LIKE LISTED THANKS Five Stars
1399311,B001DKMZ3G,2,There is very little variety between the colors. No variety.
1399312,B001DKMZ3G,5,Incredible experience with a colored pencil and patterns of our universe. Five Stars
1399313,B001DKMZ3G,5,Just what I was looking for.  Good selection of colors. Good selection of colors
1399314,B001DKMZ3G,4,Good product only reason I didn't give it 5 stars is because some of the colors are not even close to what they say the color is. The gold colored pencil colors completely silver. Other than that I'm happy with this product. Good product only reason I didn't give it 5 stars ...
1399315,B001DKMZ3G,4,"I've used these before with success so I anticipate the same quality with this batch. I knocked off a star for lack of color intensity and selection. But, they're better than the uber-cheapies and more affordable than professional grade. If you like to doddle or use adult coloring books, etc. These will work fine. Given an option, I'd have rated 3.5 stars. Color me above average"
1399316,B001DKMZ3G,5,Great pencils for a great price. Good...
1399317,B001DKMZ3G,5,No further comments at this time. Five Stars
1399318,B001DKMZ3G,2,Disappointed.  Not bright colors that I was expecting! Disappointed. Not bright colors that I was expecting
1399319,B001DKMZ3G,5,very nice so the wife said Five Stars
1399320,B001DKMZ3G,5,Great color selection Five Stars
1399321,B001DKMZ3G,5,I was missing a color and the folks at Sargent sent a replacement right out. Five Stars
1399322,B001DKMZ3G,5,Don't receive it expected 50 different colors!  Some are either the same or VERY close and the pigment is dull.  Still a good price. NOT 50 Different colors But good price!
1399323,B001DKMZ3G,5,The grand kids love them. Five Stars
1399324,B001DKMZ3G,4,"These pencils are actually very nice, though some of the colors come off a little odd, mostly the gold comes out looking like a normal graphite gray, but they are still great, and there is a great selection of colors and are really smooth. Very nice"
1399325,B001DKMZ3G,5,exactly as described Five Stars
1399326,B001DKMZ3G,5,great price for a nice selection of colors Five Stars
1399327,B001DKMZ3G,5,nice pack of coloring pencils. 50 different colors. you get all verity of colors. a lot of fun using these pencils. nice pack of coloring pencils
1399328,B001DKMZ3G,5,Great colors Five Stars
1399329,B001DKMZ3G,5,Great Product-good price-speedy delivery. Five Stars
1399330,B001DKMZ3G,5,"Very nice, the tips stay firm and don't split.  And the price is great. Winner"
1399331,B001DKMZ3G,5,10 Heavy
1399334,B001DKMZ3G,4,"Good quality pencils.  I was a little disappointed that there were duplicates of some, and it is very hard to tell the difference between some colors that have different names. Good quality"
1399335,B001DKMZ3G,4,Received two white pencils so Four Stars
1399336,B001DKMZ3G,5,Perect Love these....
1399337,B001DKMZ3G,5,These pencils are wonderful! I love them. Five Stars
1399338,B001DKMZ3G,5,Great pencils. My daughter loves to use them for everything. Five Stars
1399339,B001DKMZ3G,5,very smooth to painth weith Five Stars
1399340,B001DKMZ3G,5,"Love these pencils, I needed more and the ones from the art supply store are really expensive, these are almost as good and not nearly as much. A great addition to my drawing arsenal. The color are great and strong, not waxy looking like some colored pencils come off as. I will certainly be ordering more once they start getting low Love the colors"
1399341,B001DKMZ3G,5,My mother loves them very nice. Five Stars
1399342,B001DKMZ3G,5,"My wife got an adult coloring book for Christmas and needed pencils to go with it. I got these, she likes them and has enjoyed the stress reducing coloring. she likes them and has enjoyed the stress reducing coloring"
1399343,B001DKMZ3G,5,"I have not used them yet, but I love the colors! Beautiful Colors of Your Life"
1399344,B001DKMZ3G,5,I  live these colored pencils.  They color very well & blend well.  They also sharpen to a good point with a manual hand-held pencil sharpener.  Some of the colors are pretty close to the same especially the greens.  The only real complaint I have is the Gold color looks nothing like gold when you use it.  It's color almost exactly the color of Grey or Silver. Nice Assortment of Colors
1399345,B001DKMZ3G,5,"The assortment of colors is great.  And, the pencils also have vivid colors and sharpen well as some pencils just fall apart when sharpened.
I think it was a great value also.  Tried some other brands less expensive and more expensive and the colors were not as vivid and also the pencils did not sharpen well and so very frustrating.  But, this brand is quite good I have to say out of the few brands I have tried and was very satisfied with this purchase overall. The assortment of colors is great. And"
1399346,B001DKMZ3G,2,not like the photo... Two Stars
1399347,B001DKMZ3G,5,Work great Five Stars
1399348,B001DKMZ3G,5,Definitely buying the 50ct! Perfect
1399351,B001DKMZ3G,5,"This set of Sargent Colored Pencils is fantastic. The colors are absolutely gorgeous. They are vivid and bright! It is easy to shade with them and make different textures. These colored pencils are easy to sharpen. The pencils are very pigmented so the pencils are lasting longer than cheaper ones I have bought. Like MUCH longer!

I really like the selection of colors that Sargent chose for this set. I recently bought a different set and there were so many shades of blue, but 1 shade of pink. This set has a good rounded selection of all the shades you need!

These colored pencils are fantastic for this crazy new adult coloring hobby that everyone is into! They will last a long time and your pictures will be gorgeous! I was so impressed with my set, I purchased a second set for my mom for Mother's Day! She loves them too! Great color selection and highly pigmented to last longer!"
1399352,B001DKMZ3G,5,good Five Stars
1399353,B001DKMZ3G,5,:) Five Stars
1399355,B001DKMZ3G,5,"I'm an avid user of colored pencils and I like this set of 50 Sargent Colored Pencils very much. I like to color in adult coloring books that help relieve stress and some of the patterns in adult coloring books are very intricate. Your pencils need to have very sharp tips in order to stay inside the lines when coloring in these types of coloring books, so you have to sharpen the pencils frequently. Thankfully, these colored pencils sharpen easily but the tips don't break easily. Also, the colors are pretty and bright and they're arranged to compliment each other very well. You don't have to press down really hard to get a nice even shade, either. All colored pencils are not equal. I've bought many sets that were more expensive than this set that were basically barely usable for my purposes. I'm impressed with the quality and the shades of these colored pencils and I will definitely purchase them again in the future when I need more.

*I purchased this product at a reduced price in exchange for my honest and unbiased review. This is a great quality set of 50 Sargent Colored Pencils. They color nicely, sharpen well & they don't break easily. Impressive"
1399356,B001DKMZ3G,4,they are ok Four Stars
1399357,B001DKMZ3G,5,"All the colors you need to start adult coloring books, a good selection of everything you need to start.  Tips don't seem very fragile but still color great Adult coloring must have"
1399358,B001DKMZ3G,4,"Smooth colors, very vibrant. Container is well constructed and not flimsy. Smooth and vibrant colors!"
1399359,B001DKMZ3G,4,Great pencils for the price. Four Stars
1399360,B001DKMZ3G,5,These were good enough to also order the 120 package. Five Stars
1399361,B001DKMZ3G,5,"Great for the adult coloring book I gave my wife for a gift.  She loves to color and is so happy the adult books are available now.  She always felt sort of silly coloring a Disney or Nursery Rhyme coloring book.  These pencils hold the tip quite well, color smoothly, grip easily.  She loves them...much better than crayons for her purposes. Great coloring aid!"
1399362,B001DKMZ3G,5,I bought these for a friend and she absolutely loves the quality of them. She said they true and rich in color. Great Pencil Set
1399363,B001DKMZ3G,5,Nice Five Stars
1399364,B001DKMZ3G,5,love these! Five Stars
1399365,B001DKMZ3G,4,Purchased this for my sons fianc&eacute;es  second youngest daughter. When she enrolled in school here (she started the school year in another state . She was very pleased with the school supplies  I got from Amazon  and so was I -quality products at a reasonable price! She was very pleased with the school supplies I got from Amazon  ...
1399366,B001DKMZ3G,5,Colors very good Five Stars
1399367,B001DKMZ3G,2,Not a lot of color selection - several colors are very similar in shade. Color doesn't apply well on paper - have to apply a few times to see the color. Not a lot of color selection - several colors are ...
1399368,B001DKMZ3G,4,Bought for my wife Bought for my wife
1399369,B001DKMZ3G,4,very good for the price and the grandkids! Four Stars
1399370,B001DKMZ3G,4,"I purchased these because I didn't know if I would like coloring. So, I purchased the least expensive with the most colors. It turns out I love it. These work very well, but they are not soft core. For a first set to test they were great. I have better ones now. ... purchased these because I didn't know if I would like coloring. So"
1399371,B001DKMZ3G,4,"I love the colors, great price as well! Dew et"
1399372,B001DKMZ3G,1,"the colors are not bright at all,dificult to erase, and many pens give the same color. I donot recommend it at all. I donot recommend it at all"
1399373,B001DKMZ3G,5,"I received Sargent Art 22-7251 Colored pencils Package
of 50 - 2pkg...on 05-12-16

Willie Mae deGraffenried Five Stars"
1399374,B001DKMZ3G,5,"Wide range of colors for the current trend of women's coloring books, plus extra black and white pencils. Five Stars"
1399375,B001DKMZ3G,4,"The product(s) arrived on time, as described by Amazon & manufacturer, it was shipped without issue, arrived within prescribed estimates, the packaging was undamaged, and the product itself was unmolested and made with quality materials.

Although the description, photograph, website presentation, and what arrived are the same-size, shape, color, it didn't live up to my expectations.  I thought the colors would be more vibrant, the difference between same group colors is minimal at best, and even with the articulated drawbacks, they do well in comparison to industry contemporaries (which cost more with only slight, if not a bit more, improvement in performance). A solid product"
1399376,B001DKMZ3G,4,Worth the money. Four Stars
1399377,B001DKMZ3G,5,Bought as a Mothers Day gift with Adult coloring books.  She loves them! Great to gift with adult coloring books
1399378,B001DKMZ3G,5,love them !  no matter the amount of pressure applied ... no breakage what so ever !! love them! no matter the amount of pressure applied
1399379,B001DKMZ3G,5,"Love these pencils! For the price, they're awesome! I use them to color in my coloring book which I have been using to de-stress myself lately. They're very pigmented and do not break easily. Love these pencils"
1399380,B001DKMZ3G,5,I do a lot of coloring and have recently joined the promotion team of two great Indie Coloring book artist so it's important that I have good quality pencils and supplies that are affordable. Sargent pencils are smooth and make it easy to not only blend but shade to the degree I need. ... and have recently joined the promotion team of two great Indie Coloring book artist so it's important that I ...
1399381,B001DKMZ3G,5,Love them Five Stars
1399382,B001DKMZ3G,2,"Not really a fan of these. I normally get the name brand but decided to save a few bucks and go with a good rated one instead. Kind of regret it. The colors aren't vibrant but soft instead. I thought 50 colored pencils would give me variety but i don't see it or maybe im just not happy overall with the choices.
A lot of the time the color is A LOT lighter then the color of pencil when you color with it. Ie. The pencil is dark blue but it comes out much lighter. Im just not a fan. I was expensive vibrant bright colors.
Ill use them. I spent the money and its just to cure bordem but i know for next time.. Pale colors"
1399384,B001DKMZ3G,4,Good assortment of colors. Four Stars
1399385,B001DKMZ3G,5,Good Five Stars
1399386,B001DKMZ3G,4,Bought these for my 10 year old niece. She loves the colors. She likes to design dresses so the colors are closer to real deal instead of Crayola colors. great for earth tone projects
1399388,B001DKMZ3G,5,Great price Five Stars
1399389,B001DKMZ3G,5,Great for my adult coloring :) Five Stars
1399390,B001DKMZ3G,5,2nd time to buy the product. worth the price I paid for. Five Stars
1399392,B001DKMZ3G,5,Love Five Stars
1399393,B001DKMZ3G,5,wife loves Five Stars
1399394,B001DKMZ3G,5,It has vivid shades and  I like it. like it
1399396,B001DKMZ3G,5,Love all the colors in this big back! Just what I was looking for to use in my adult coloring books. Love all the colors in this big back
1399397,B001DKMZ3G,5,"These are definitely not artist grade but they're great for regular coloring. Better than Crayola IMO. For the amount of pencils and color variations, the price can't be beat. Great set for beginners. They sharpen well with no breakage. They are a little waxy and it is rather hard to blend with these, but not impossible. Overall, happy with the purchase. Great for beginners"
1399398,B001DKMZ3G,5,Adult coloring is all the rage now...don't have to be a kid to enjoy it anymore love to color
1399399,B001DKMZ3G,2,The colors are not at all what they look like. My 4 yr boy ever noticed and complained. I had to buy another set! The colors are not at all what they look like. My 4 yr boy ever noticed and complained
1399400,B001DKMZ3G,5,"Its simple these are the best colored pencils ever owned. I highlight the books I read with colored pencils and bought Crayola's before this pack I thought it was normal every time I sharpened them the point would break off and get stuck in the sharpener. In my opinion, The Sargent Pencils are significantly better. Didn't realize colored pencils were so expensive these days. Guess its because I never had to pay for them as a kid ! Its simple these are the best colored pencils ever owned"
1399401,B001DKMZ3G,4,Good assortment of colors! Good price! Four Stars
1399402,B001DKMZ3G,4,Good! Four Stars
1399403,B001DKMZ3G,5,Great pencils!!! Five Stars
1399404,B001DKMZ3G,4,work fine. Four Stars
1399405,B001DKMZ3G,4,The colors are vivid and easy to use and shading is easier Four Stars
1399406,B001DKMZ3G,5,Great coverage when using. Brilliant color. Fantastic coloring pencils.
1399407,B001DKMZ3G,5,Great pencils. Five Stars
1399408,B001DKMZ3G,5,Super cute gift with adult coloring book. Five Stars
1399409,B001DKMZ3G,5,Exactly as described. Fast shipping! Love all the colors. Love all the colors
1399410,B001DKMZ3G,5,Better quality than other colored pencils I have purchased. Five Stars
1399411,B001DKMZ3G,4,"Pretty good pencil, much better than the cheaper brands. A bit difficult to sharpen and keep sharp. Points are easy to break. Good product"
1399413,B001DKMZ3G,5,Nice set with lots of beautiful colors. Five Stars
1399414,B001DKMZ3G,5,A lot for the money. Five Stars
1399415,B001DKMZ3G,5,Great broad array of colors and fantastic quality! Five Stars
1399416,B001DKMZ3G,5,Really a great set of pencils! Complete. And so many colors!! This is the one!
1399417,B001DKMZ3G,5,"Great for beginners. I just started coloring, so can't afford anything fancy. I wouldn't know hot to do fancy anyway! But as I learn, I'm sure I'll want to move up to the better coloring tools. For now though, these are great. They don't break and they are individually named (unlike another pack I got that didn't give a name for the color of the pencil ... weird). Anyway, I'm starting out with these and some gel markers I got from the Dollar Store. The picture I've attached was done with these pencils and the $ Store markers. Great for beginners!"
1399418,B001DKMZ3G,5,"nice array and a lot of cute colors that I didn't really expect. Price points are spot on. So far after early use I've that the coloring ""lead"" is intact all the way from top to bottom. Very happy with the product. nice array and a lot of cute colors that I ..."
1399419,B001DKMZ3G,5,Bellos me encantaron Five Stars
1399420,B001DKMZ3G,5,"fast shipping, great product..A+! great product."
1399421,B001DKMZ3G,4,"I wanted a large pack of colored pencils so I could have a variety of colors to use in my adult coloring book. So far it has been just what I needed: obviously higher quality than children's colored pencils, but probably not what you are looking for if you are wanting to do a more professional colored pencil piece of art. Perfect for a wide variety of colors to pick from if you are simply wanting to color and be entertained. Good quality for recreational coloring"
1399422,B001DKMZ3G,4,Not exactly what I expected. Four Stars
1399423,B001DKMZ3G,5,Very good pencils and colors. Excellent
1399424,B001DKMZ3G,5,"It really came before expected, i love the product and for the prize i can complain at all i love the product and for the prize i can complain ..."
1399425,B001DKMZ3G,5,Nice color pencil set.  soft pencils which I like to work with Five Stars
1399426,B001DKMZ3G,5,As promised Five Stars
1399427,B001DKMZ3G,1,"I do not like this product. I don't feel they put enough thickness in the pencil and I don't feel there is enough dye in the color. I say this because I'm constantly having to sharpen and have to push down so hard. And I hope this isn't done to make the pencil degenerate faster to cause the consumer have to purchase a renewal quicker. Maybe I got a bad pack, but I have to review on what I received. I will not purchase this product again but another name brand. Not recommended"
1399428,B001DKMZ3G,4,"Here is a great selection of pencils, with a lot of colors.  It would be great for students, adult coloring book fans, or even kids.  Because the price was low, I am more willing to use these pencils for experimentation.  Some of the colors are very similar.  They all come sharpened and stay pretty sharp.  They don't lay down an extremely bright color without a lot of layers. Not as good as the topline Derwent, Prismacolor or Polychromos but a great selection of colors at a good price"
1399429,B001DKMZ3G,5,these r easy to use great colors Five Stars
1399430,B001DKMZ3G,5,"Became irritated with store bough colored pencils. Even Crayola wasn't holding up. Purchased these and I love the color quality, and other than me having a crappy sharpener (which I plan to replace) I have not had one issue with the lead breaking. Highly recommended. Great for Adult Coloring Books"
1399431,B001DKMZ3G,1,"I bought these last year but now just got back into my coloring, colors are fine but every time I try to sharpen the stupid things the less break off. I use the same sharpener on my Raffine pencils and my crayola with no issues. colors are fine but every time I try to sharpen the stupid ..."
1399432,B001DKMZ3G,4,Great colours and texture of pencils. Four Stars
1399433,B001DKMZ3G,5,Nice variety of colors to use with coloring books or for drawing. Five Stars
1399434,B001DKMZ3G,5,These are great.  I love the variety and the pencils stay sharp even after several times using them.  There is even a chart on the back that tells you what the colours are.  I enjoy using these all the time. These are great. I love the variety and the pencils stay ...
1399435,B001DKMZ3G,5,Us  COLORED  PENCILS  IT  MAKES  IT  STAND  OUT  BETTER. ADULT  COLORINGBOOK
1399436,B001DKMZ3G,5,I was very pleased with the quality of the pencils!!! I also like the variety of colors. Thank you very much! I was very pleased with the quality of the pencils
1399437,B001DKMZ3G,5,Good quality! Five Stars
1399438,B001DKMZ3G,5,Well pleased...wish there were a few more colors Five Stars
1399439,B001DKMZ3G,4,"The pencils are very good and a nice verity of colors, they are a harder pencil than two other brands I have and because of that you cannot get the colors very dark.  I use them when I need more pastel or lighter shading. Nice color verity"
1399440,B001DKMZ3G,5,"I love my ""adult coloring books"" and to have this many colors at this price???  LOVE IT. Five Stars"
1399443,B001DKMZ3G,5,Bought these for a friend and she loves them! Will be buying some for myself now. Great pencils for coloring...
1399444,B001DKMZ3G,5,Great pencils Five Stars
1399445,B001DKMZ3G,4,"Nothing spectacular, but great set of pencils. Use to color in my books, daughter uses to draw freehand art. but great set of pencils"
1399446,B001DKMZ3G,5,Excellent quality product Five Stars
1399447,B001DKMZ3G,5,pencils are very good Five Stars
1399448,B001DKMZ3G,5,I like these pencils I've ordered 2 & I'm going for the 3rd set BEST PENCIL IN ART
1399449,B001DKMZ3G,5,I bought these as a gift for my daughter who loves the adult coloring books.  She was thrilled with the wide range of colors. They sharpen evenly and the colors are great. A Great Gift
1399450,B001DKMZ3G,5,Love all the colors and the price was so reasonable! Five Stars
1399451,B001DKMZ3G,5,These are excellent for my purposes. I'm learning how to work with pencils and blend colors. These are working fine. These are excellent for my purposes
1399452,B001DKMZ3G,2,Overpriced color you can barely see Dull lifeless colors
1399453,B001DKMZ3G,5,"The leads are smooth, vibrant color for 99% of the colors.  The only thing I did not like was that there were 2 white and 2 black pencils.  I would have rather had different colors.  There is very little crumbling of the lead unless you have a really fine point then it tends to leave crumbles on the paper.  Otherwise a great alternative to Crayola (good product, just too expensive).  I like the price point and the matching quality!!  I will be purchasing another box again soon (I use them a lot!!) The only thing I did not like was that there were 2 white and 2 black ..."
1399454,B001DKMZ3G,4,Good pencils at a good price. Four Stars
1399455,B001DKMZ3G,5,great set of colors Five Stars
1399456,B001DKMZ3G,5,Best pencils I will be refilling always Five Stars
1399457,B001DKMZ3G,5,Good quality Five Stars
1399458,B001DKMZ3G,2,"Does very average color, dry and hard to blend. color art."
1399459,B001DKMZ3G,5,Great variaty of colory Five Stars
1399460,B001DKMZ3G,5,love them Five Stars
1399461,B001DKMZ3G,2,Very little color and very hard. To light
1399462,B001DKMZ3G,5,Great quality pencils. Aduly coloring is the best. Five Stars
1399464,B001DKMZ3G,5,I love the color selection. I love the color selection
